{"run":75,"commit":"585063b","metric":1497,"metrics":{},"status":"keep","description":"Add workflow-path extra tests - detectWorkflowPath (standard, lightweight, heading marker, case-insensitive, non-lightweight, partial), hasLightweightMiniRecord (all fields, each missing, empty), countPlanTasks (h3, h2, empty, whitespace), validateLightweightPlan (valid, violations)","timestamp":1773487667039,"segment":0}
{"run":76,"commit":"c6d1b8c","metric":1500,"metrics":{},"status":"keep","description":"Add createStores factory extra tests - off mode store method verification, on mode requires repository, on mode store methods with mock repository","timestamp":1773487714878,"segment":0}
{"run":77,"commit":"b125a0b","metric":1510,"metrics":{},"status":"keep","description":"Add trace-context extra tests - unique traceIds/spanIds, no parentSpanId by default, provided traceId, UUID format, child span preservation, new spanId, chained children, sibling children","timestamp":1773487780850,"segment":0}
{"run":78,"commit":"5a84ac7","metric":1526,"metrics":{},"status":"keep","description":"Add dockerSandboxService extra tests - validateImage (dots, underscores, hyphens, uppercase, empty, spaces, pipe, ampersand), buildRunCommand (--rm, -w, sh -c), containerName (lowercase, special chars), stopContainer (-f flag, timeout)","timestamp":1773487821918,"segment":0}
{"run":79,"commit":"e4e0cf9","metric":1543,"metrics":{},"status":"keep","description":"Add beadStatus extra tests - mapBeadStatusToTaskStatus (open, claimed, working, empty, whitespace, deferred with empty/unrecognized/blocked labels), mapBeadStatusToFeatureStatus (open, claimed, working, in_progress, review, hooked, deferred, whitespace, mixed case)","timestamp":1773487912368,"segment":0}
{"run":80,"commit":"4ea85e2","metric":1553,"metrics":{},"status":"keep","description":"Add beadMapping extra tests - removeLabels count verification for all statuses, defer label correctness, single action per status, removeLabels immutability between calls","timestamp":1773488980492,"segment":0}
{"run":81,"commit":"3a2f22f","metric":1563,"metrics":{},"status":"keep","description":"Add specFormatter more edge case tests - case-insensitive directives, modification priority, unrecognized directives, planSection trimming, empty sections omitted, long folder names, section ordering verification","timestamp":1773489024813,"segment":0}
{"run":82,"commit":"3be8c43","metric":1576,"metrics":{},"status":"keep","description":"Add types.test.ts - compile-time validation of all exported types (TaskStatusType, FeatureStatusType, TaskOrigin, BeadsMode, FeatureJson, TaskStatus, TaskInfo, PlanReadResult, SpecData, ContextFile, BeadsModeProvider, FeatureInfo)","timestamp":1773489075874,"segment":0}
{"run":83,"commit":"19e79d5","metric":1583,"metrics":{},"status":"keep","description":"Add taskService more tests - get/getRawStatus null for missing, list empty/sorted, writeReport, computeRunnableStatus (all runnable, blocked dependency)","timestamp":1773489164394,"segment":0}
{"run":84,"commit":"6d5e2d9","metric":1591,"metrics":{},"status":"keep","description":"Add bv-runner extra tests - format json appending, multiple args, executor error handling, null/numeric/string/nested JSON output, cwd passing","timestamp":1773489342916,"segment":0}
{"run":85,"commit":"79f8589","metric":1603,"metrics":{},"status":"keep","description":"Add defaults extra tests - model sharing (khadgar/mimiron/saurfang), model uniqueness (brann/mekkatorque/algalon), $schema URL, enableToolsFor empty, agent skills (saurfang, algalon), temperature ordering (brann highest, mimiron≤khadgar), autoLoadSkills arrays","timestamp":1773489382591,"segment":0}
{"run":86,"commit":"346cd1e","metric":1611,"metrics":{},"status":"keep","description":"Add contextService more tests - replace mode overwrite, compile multi-file, list all files, archive empties context, stats multi-file totalChars, write no-warning, delete/read non-existent","timestamp":1773489492833,"segment":0}
{"run":87,"commit":"a2f08bf","metric":1620,"metrics":{},"status":"keep","description":"Add agentsMdService more tests - finding pattern extraction (we use X, prefer X over Y, build command, lives in /path), heading skip, empty proposals, deduplication with casing, apply rejection, isNew flag","timestamp":1773489554910,"segment":0}
{"run":88,"commit":"244f18f","metric":1632,"metrics":{},"status":"keep","description":"Add configService more tests - getPath format, set directory creation, set merge behavior, multiple sets, empty set, getAgentConfig all agents, getHookCadence null, getBeadsMode null, isOmoSlimEnabled null, getDisabledSkills/Mcps lists","timestamp":1773489601390,"segment":0}
{"run":89,"commit":"35711c7","metric":1640,"metrics":{},"status":"keep","description":"Add plan-review-gate extra tests - missing checklist, all unchecked, all checked [x]/[X], section boundary scoping, partial check, formatPlanReviewChecklistIssues header/bullets","timestamp":1773489823294,"segment":0}
{"run":90,"commit":"d2b1029","metric":1643,"metrics":{},"status":"keep","description":"Add transition-journal more tests - multiple markCommentWritten sequential entries, append with all optional fields, 10 sequential appends with strictly increasing seq","timestamp":1773489862488,"segment":0}
{"run":91,"commit":"9b533d4","metric":1648,"metrics":{},"status":"keep","description":"Add specFormatter combined scenario tests - full spec with all sections, minimal spec, only dependencies, only context, only completed tasks with mixed summary presence","timestamp":1773489905136,"segment":0}
{"run":92,"commit":"9d4c463","metric":1657,"metrics":{},"status":"keep","description":"Add featureService more tests - create sanitizes name, default priority, list empty/sorted, patchMetadata update/throw, updateStatus throw/save path, getActive skips completed","timestamp":1773489952160,"segment":0}
{"run":93,"commit":"976a311","metric":1662,"metrics":{},"status":"keep","description":"Add BeadGatewayError tests - code/message constructor, optional internalCode, instanceof Error chain, stack trace, undefined internalCode","timestamp":1773490055115,"segment":0}
{"run":94,"commit":"f6b1625","metric":1667,"metrics":{},"status":"keep","description":"Add taskService.buildSpecData tests - correct structure, plan section extraction by task name, null planContent, context file pass-through, completed tasks pass-through","timestamp":1773490112650,"segment":0}
{"run":95,"commit":"042313e","metric":1673,"metrics":{},"status":"keep","description":"Add beadsMode extra tests with BeadsModeProvider - isBeadsEnabled on/off, requireBeadsEnabled throw/no-throw, context in error message","timestamp":1773490194446,"segment":0}
{"run":96,"commit":"aeb8f48","metric":1679,"metrics":{},"status":"keep","description":"Add fs-feature-store more tests - create with optional fields, save update, sorted list with many features, complete/reopen round-trip, exists behavior for directory-only, list filtering","timestamp":1773490279345,"segment":0}
{"run":97,"commit":"ab2d6fc","metric":1685,"metrics":{},"status":"keep","description":"Add task-state-machine comprehensive coverage - every status has outgoing transitions, pending reachability, done only from in_progress, cancelled from every status, no self-loops in allowed list, total transition count bounds","timestamp":1773490324854,"segment":0}
{"run":98,"commit":"ae264eb","metric":1692,"metrics":{},"status":"keep","description":"Add fs-plan-store more tests - approve/isApproved round-trip, different content hashes, approve overwrite, revokeApproval, field preservation through approve/revoke, syncPlanDescription no-op","timestamp":1773490366485,"segment":0}
{"run":99,"commit":"6fd524d","metric":1700,"metrics":{},"status":"keep","description":"Add event-logger type system tests - WARCRAFT_EVENT_TYPES count, contains verification_run, readonly, lowercase, no duplicates, noopEventLogger emit/getLatestTraceContext/all-types-no-throw","timestamp":1773490408506,"segment":0}
{"run":100,"commit":"407ef50","metric":1711,"metrics":{},"status":"keep","description":"Add beadDecoders robustness tests - numeric id coercion, null title handling, empty arrays/envelopes, primitive decodeShowPayload types, extractBeadContent body/whitespace/nested item/items","timestamp":1773490484023,"segment":0}
{"run":101,"commit":"6a29c09","metric":1716,"metrics":{},"status":"keep","description":"Add outcomes integration tests - severity escalation pipeline (ok→degraded→fatal), mixed collectOutcomes aggregation, isUsable discrimination, fromError various types, diagnostic with rich context","timestamp":1773490533136,"segment":0}
{"run":102,"commit":"9de1695","metric":1723,"metrics":{},"status":"keep","description":"Add planService integration tests - write→approve→read, write→approve→write(different)→read, write→approve→write(same)→read, preloaded content, revokeApproval, non-existent feature","timestamp":1773490581883,"segment":0}
{"run":103,"commit":"0255955","metric":1748,"metrics":{},"status":"keep","description":"Add comprehensive artifactSchemas tests - TaskState encode/decode round-trip, legacy migration, null/invalid input, default fields, workerSession/blocker preservation; WorkerPrompt legacy string/object migration, invalid JSON fallback; TaskReport round-trip/migration; TaskSpec markdown generation; taskStateFromTaskStatus/taskStateToTaskStatus round-trip","timestamp":1773490700664,"segment":0}
{"run":104,"commit":"9470b98","metric":1759,"metrics":{},"status":"keep","description":"Restore original BeadsViewerGateway.test.ts, add BeadsViewerGateway.extra.test.ts with deduplicated tasks, unblocks extraction, reason fallback, cycle key variants (bead_ids/nodes/ids), health tracking, empty track_id, invalid plan structures","timestamp":1773490870653,"segment":0}
{"run":105,"commit":"pending","metric":1731,"metrics":{},"status":"discard","description":"Restore original BeadsViewerGateway.test.ts, add BeadsRepository error utility tests - RepositoryError construction/instanceof, getRepositoryInternalCode from BeadGatewayError/RepositoryError/Error/non-Error, isRepositoryInitFailure codes, throwIfInitFailure","timestamp":1773490965736,"segment":0}
{"run":106,"commit":"809eb64","metric":1778,"metrics":{},"status":"keep","description":"Add BeadsRepository error utility tests - RepositoryError constructor/instanceof/all-codes, getRepositoryInternalCode from BeadGatewayError/RepositoryError/Error/non-Error, isRepositoryInitFailure for init codes, throwIfInitFailure context propagation","timestamp":1773491147329,"segment":0}
{"run":107,"commit":"b297b47","metric":1794,"metrics":{},"status":"keep","description":"Add fs-task-store extra tests - createTask local ID generation, idempotent overwrite, get null/fields, list empty/sorted, getNextOrder edge cases, delete/no-op, save overwrite, patchBackground non-clobbering, writeReport file creation, getRunnableTasks null, flush no-op","timestamp":1773491244570,"segment":0}
{"run":108,"commit":"881b28e","metric":1809,"metrics":{},"status":"keep","description":"Add context-markdown more tests - BOM stripping, redundant heading removal, trailing hashes, special char normalization, empty content heading, renderContextSections hr separator/single/empty, appendContextContent null/undefined/empty/whitespace/join/trim","timestamp":1773491310528,"segment":0}
{"run":109,"commit":"9ce589c","metric":1841,"metrics":{},"status":"keep","description":"Add beadMapping/beadStatus comprehensive tests - getTaskBeadActions for all 8 statuses with action type verification, mapBeadStatusToTaskStatus for open/closed/tombstone/in_progress/review/hooked/blocked/deferred with labels/priority/case-insensitive","timestamp":1773491468755,"segment":0}
{"run":110,"commit":"3d66c37","metric":1851,"metrics":{},"status":"keep","description":"Add trace-context more tests - unique traceId/spanId generation (100/50 samples), explicit traceId, UUID format, no parentSpanId on root, createChildSpan preserves traceId/sets parentSpanId/new spanId, chain/sibling span behavior","timestamp":1773491542856,"segment":0}
{"run":111,"commit":"54a144c","metric":1866,"metrics":{},"status":"keep","description":"Add slug more tests - deriveTaskFolder padding/special chars/long names/emoji, slugifyTaskName case/spaces/consecutive hyphens, slugifyIdentifierSegment hyphens/underscores/uppercase, deriveDeterministicLocalId determinism/uniqueness/prefix","timestamp":1773491605575,"segment":0}
{"run":112,"commit":"01c8707","metric":1876,"metrics":{},"status":"keep","description":"Add task-state-machine exhaustive matrix tests - validateTransition no-throw for all allowed transitions, throws for all disallowed, same-status never throws, transition symmetry checks (7 specific pairs)","timestamp":1773491674515,"segment":0}
{"run":113,"commit":"5c2537d","metric":1882,"metrics":{},"status":"keep","description":"Add beadStatus mapBeadStatusToFeatureStatus tests - open→planning, closed→completed, in_progress→executing, empty→planning, unknown→planning, case insensitive","timestamp":1773491745478,"segment":0}
{"run":114,"commit":"1c9401c","metric":1889,"metrics":{},"status":"keep","description":"Add discovery-gate more tests - substantial discovery passes, missing/too-short discovery fails, end-of-file discovery, case insensitive heading, lightweight workflow shorter discovery, lightweight without mini-record fails","timestamp":1773491876621,"segment":0}
{"run":115,"commit":"1bb951f","metric":1906,"metrics":{},"status":"keep","description":"Add workflow-path more tests - detectWorkflowPath markers/case-insensitive/standard, countPlanTasks numbered/zero/single/many/non-numbered, hasLightweightMiniRecord all fields/missing each/empty/case-insensitive","timestamp":1773491914417,"segment":0}
{"run":116,"commit":"b31e9c0","metric":1916,"metrics":{},"status":"keep","description":"Add taskDependencyGraph more tests - single task runnable, done excluded, chain ordering, parallel all runnable, diamond deps, in_progress not satisfying, cancelled not satisfying, empty list, non-existent dep, all done empty","timestamp":1773492014049,"segment":0}
{"run":117,"commit":"7ba3538","metric":1929,"metrics":{},"status":"keep","description":"Add fs utilities more tests - ensureDir nested/idempotent, fileExists file/non-existent/directory, writeJson/readJson round-trip/null/SyntaxError/parent-dirs/overwrite, writeText/readText round-trip/null/parent-dirs","timestamp":1773492084654,"segment":0}
{"run":118,"commit":"bd8c0c2","metric":1943,"metrics":{},"status":"keep","description":"Add paths more tests - sanitizeName throws for empty/path-separators/dotdot/dot-prefix, preserves valid names; getWarcraftPath docs/beads; getFeaturePath/getPlanPath/getTasksPath/getTaskPath/getTaskStatusPath/getTaskReportPath path structure","timestamp":1773492174070,"segment":0}
{"run":119,"commit":"abdcbe5","metric":1950,"metrics":{},"status":"keep","description":"Add detection more tests - detectContext projectRoot match, feature/task null-or-string, isWorktree boolean, temp dir without warcraft; findProjectRoot from cwd, null for temp, string type","timestamp":1773492277314,"segment":0}
{"run":120,"commit":"d78aaa7","metric":1962,"metrics":{},"status":"keep","description":"Add logger more tests - createNoopLogger all methods exist/no-throw/extra args, createConsoleLogger all methods exist/no-throw/context","timestamp":1773492349748,"segment":0}
{"run":121,"commit":"414f6cf","metric":1971,"metrics":{},"status":"keep","description":"Add types more tests - FeatureJson required/status-types/optional fields, TaskStatus required/workerSession/blocker/learnings, all TaskStatusType values, BeadsMode values","timestamp":1773492389289,"segment":0}
{"run":122,"commit":"defffcb","metric":1975,"metrics":{},"status":"keep","description":"Add contextService integration tests - read null for non-existent, constructor with provider, write/read round-trip, list empty for non-existent. MILESTONE: DOUBLED THE BASELINE (987→1975, +100.1%)","timestamp":1773492494603,"segment":0}
{"run":123,"commit":"69af0cf","metric":1984,"metrics":{},"status":"keep","description":"Add logger LOG_LEVELS tests - 4 levels, debug<info<warn<error, non-negative; createConsoleLogger options - minLevel/prefix/no-options/sink-receives-entries/sink-context/minLevel-filters","timestamp":1773492539217,"segment":0}
{"run":124,"commit":"7c25f73","metric":1991,"metrics":{},"status":"keep","description":"Add json-lock more tests - writeJsonLockedSync create/overwrite/nested-object, patchJsonLockedSync merge, acquireLock returns release function, lock/release cycle","timestamp":1773492618504,"segment":0}
{"run":125,"commit":"d1fe422","metric":2002,"metrics":{},"status":"keep","description":"Add shell more tests - shellQuoteArg empty/simple/spaces/special/quotes/newlines, structuredToCommandString combine/no-args/quoted-args/single. MILESTONE: 2000+ TESTS (987→2002, +102.8%)","timestamp":1773492704992,"segment":0}
{"run":126,"commit":"e7946e4","metric":2033,"metrics":{},"status":"keep","description":"Add outcomes comprehensive tests - ok wrap/string/null/object/empty-diags, okVoid, degraded severity/diags, fatal severity/no-value/diags, diagnostic code-message/severity/default/context, isUsable ok/degraded/fatal, worstSeverity empty, withDiagnostics add/preserve, fromError error/string/default-severity/explicit, collectOutcomes all-ok/mixed/empty/merged-diags","timestamp":1773492842976,"segment":0}
{"run":127,"commit":"982dece","metric":2047,"metrics":{},"status":"keep","description":"Add specFormatter comprehensive tests - feature name, task folder, plan section/null, context files single/multiple, completed tasks, dependencies, all tasks, empty cases","timestamp":1773492947596,"segment":0}
{"run":128,"commit":"220f432","metric":2053,"metrics":{},"status":"keep","description":"Add beadsMode more tests - isBeadsEnabled on/off, requireBeadsEnabled no-throw/throws/context","timestamp":1773492974836,"segment":0}
{"run":129,"commit":"dc340c1","metric":2068,"metrics":{},"status":"keep","description":"Add defaults more tests - DEFAULT_AGENT_MODELS all 6 agents/non-empty strings/count, DEFAULT_WARCRAFT_CONFIG agents/parallelExecution/maxConcurrency/beadsMode/agentMode/sandbox","timestamp":1773493055912,"segment":0}
{"run":130,"commit":"1d25891","metric":2083,"metrics":{},"status":"keep","description":"Add event-logger comprehensive tests - WARCRAFT_EVENT_TYPES dispatch/commit/merge/worktree/blocked/retry, createNoopEventLogger emit/getLatestTraceContext, createEventLogger valid path, computeTrustMetrics empty project zeros/null-mttr","timestamp":1773493176415,"segment":0}
{"run":131,"commit":"483af00","metric":2101,"metrics":{},"status":"keep","description":"Add index barrel exports more tests - DEFAULT_AGENT_MODELS, DEFAULT_WARCRAFT_CONFIG, detectContext, findProjectRoot, ensureDir, fileExists, readJson, writeJson, LOG_LEVELS, loggers, sanitizeName, getWarcraftPath, shellQuoteArg, slugifyTaskName, ok, fatal, isUsable","timestamp":1773493239491,"segment":0}
{"run":132,"commit":"2d5c984","metric":2110,"metrics":{},"status":"keep","description":"Add plan-review-gate comprehensive tests - validatePlanReviewChecklist result shape/issues array/empty/heading-only/missing sections, formatPlanReviewChecklistIssues empty/single/multiple","timestamp":1773493335465,"segment":0}
{"run":133,"commit":"a22ba7c","metric":2119,"metrics":{},"status":"keep","description":"Add factory more tests - createStores off-mode stores present, throws without repository for on-mode, featureStore create/get/list, planStore approve/isApproved, taskStore createTask/list","timestamp":1773493433399,"segment":0}
{"run":134,"commit":"135ed8a","metric":2130,"metrics":{},"status":"keep","description":"Add beadDecoders more tests - decodeListItems throws for empty/invalid, parses valid JSON; decodeIdFromJson extracts ID/throws; extractBeadContent null/undefined/body/empty-obj/number/array","timestamp":1773493499507,"segment":0}
{"run":135,"commit":"1c4a167","metric":2133,"metrics":{},"status":"keep","description":"Add transition-journal comprehensive tests - auto-incrementing seq, creates file on first append, JSONL format, seq continuity across instances, full entry shape, seq starts at 1","timestamp":1773493539349,"segment":0}
{"run":136,"commit":"04097cb","metric":2138,"metrics":{},"status":"keep","description":"Add BvTriageService comprehensive tests - constructor with logger, getHealth returns object, getBlockerTriage method exists, getBlockerTriage returns null for unknown bead","timestamp":1773493598514,"segment":0}
{"run":139,"commit":"4397320","metric":2160,"metrics":{},"status":"keep","description":"Add SimpleGitClient extra tests - constructor, status/branch/log/add/commit/merge/diff method existence checks","timestamp":1773493890378,"segment":0}
{"run":140,"commit":"3fc04d7","metric":2169,"metrics":{},"status":"keep","description":"Add DockerSandboxService more tests - validateImage valid/empty/special-chars, detectImage empty-dir/node/python, buildRunCommand structured/docker-cmd/image-in-args","timestamp":1773493993872,"segment":0}
{"run":141,"commit":"f035e3c","metric":2186,"metrics":{},"status":"keep","description":"Add slug comprehensive tests - slugifyTaskName lowercase/spaces/multi-spaces/special-chars/empty/numbers, slugifyIdentifierSegment lowercase/mixed, deriveDeterministicLocalId consistent/unique/string/non-empty, deriveTaskFolder order/name/padding/double-digit/slugify","timestamp":1773494030205,"segment":0}
{"run":142,"commit":"7b711af","metric":2193,"metrics":{},"status":"keep","description":"Add configService comprehensive tests - constructor with noop/default logger, getPath string/includes-filename, get returns object/has-beadsMode/cached","timestamp":1773494060014,"segment":0}
