{"run":143,"commit":"a891d61","metric":2203,"metrics":{},"status":"keep","description":"Add worktreeService types tests - MergeStrategy merge/squash/rebase, MergeSuccessOutcome merged/already-up-to-date/no-commits, MergeFailureOutcome conflicted/failed, MergeOutcome success/failure","timestamp":1773494097194,"segment":0}
{"run":144,"commit":"4de2a98","metric":2211,"metrics":{},"status":"keep","description":"Add state types tests - CreateFeatureInput minimal/with-ticket, TaskArtifactKind spec/worker_prompt/report, FeatureStore/PlanStore/StoreSet interface shapes","timestamp":1773494131880,"segment":0}
{"run":145,"commit":"1ada246","metric":2217,"metrics":{},"status":"keep","description":"Add BeadGateway types tests - BeadArtifactKind all 4 values, BeadGatewayError instanceof/code/message/caught, different error codes, BeadComment/AuditEntry shapes","timestamp":1773494213800,"segment":0}
{"run":146,"commit":"aea0a95","metric":2229,"metrics":{},"status":"keep","description":"Add trace-context deep tests - unique traceIds (100), format validation, spanId defined/format, custom traceId, parentSpanId undefined for root, child inherits traceId/different spanId/parentSpanId, grandchild chain, 10 unique children","timestamp":1773494333343,"segment":0}
{"run":147,"commit":"5bba54d","metric":2237,"metrics":{},"status":"keep","description":"Add discovery-gate deep tests - valid discovery null, missing/empty error, error is string, different subsections, no subsections, BOM handling, code blocks","timestamp":1773494372512,"segment":0}
{"run":148,"commit":"ca95e4e","metric":2241,"metrics":{},"status":"keep","description":"Add agentsMdService deep tests - apply returns result/throws-for-empty/handles-complex-content, init generates content for minimal project","timestamp":1773494436711,"segment":0}
{"run":149,"commit":"3ed8851","metric":2243,"metrics":{},"status":"keep","description":"Add fs-feature-store more tests - list empty, get null for non-existent, create-get round-trip, create-list, create returns object, create retrievable, create with ticket, multiple features","timestamp":1773494504416,"segment":0}
{"run":150,"commit":"dc6a186","metric":2255,"metrics":{},"status":"keep","description":"Add workflow-path deep tests - detectWorkflowPath standard-or-lightweight/complex-standard/single-standard, countPlanTasks empty/h3-headings/single/ignores-non-tasks, hasLightweightMiniRecord boolean/false-empty, validateLightweightPlan array/valid/invalid","timestamp":1773494681955,"segment":0}
{"run":151,"commit":"9880ab8","metric":2259,"metrics":{},"status":"keep","description":"Add fs-plan-store deep tests - isApproved false for non-existent, revokeApproval/syncPlanDescription/approve methods exist","timestamp":1773494855350,"segment":0}
{"run":152,"commit":"b178b87","metric":2271,"metrics":{},"status":"keep","description":"Add fs-task-store deep tests - list empty, get null, createTask/getNextOrder/save/delete/writeArtifact/readArtifact/getRunnableTasks/flush methods, getNextOrder returns 1 for empty, getRunnableTasks returns result","timestamp":1773494916456,"segment":0}
{"run":153,"commit":"393fe74","metric":2281,"metrics":{},"status":"keep","description":"Add outcomes property-based tests - isUsable consistent with ok/degraded/fatal severity, worstSeverity ordering empty/ok/degraded/fatal, collectOutcomes merges diagnostics/empty-ok/all-ok","timestamp":1773494986914,"segment":0}
{"run":154,"commit":"9b929d4","metric":2285,"metrics":{},"status":"keep","description":"Add git-client types tests - StatusResult clean/files, BranchResult current, CommitResult hash, LogResult entries, GitClient interface shape","timestamp":1773495022293,"segment":0}
{"run":155,"commit":"b83d97f","metric":2292,"metrics":{},"status":"keep","description":"Add context-markdown property tests - appendContextContent idempotent/preserves-markdown/unicode/very-long, renderContextSection heading-marker, renderContextSections joins-all-5/empty, unicode support","timestamp":1773495057487,"segment":0}
{"run":156,"commit":"255b0d4","metric":2304,"metrics":{},"status":"keep","description":"Add paths deep tests - path hierarchy consistency (feature⊂warcraft, plan⊂feature, task⊂tasks, status⊂task, report⊂task), sanitizeName security (control chars, backslash, dots, whitespace-only), getContextPath includes-feature/child-of-feature. MILESTONE: 2300+ tests","timestamp":1773495095952,"segment":0}
{"run":157,"commit":"8f3bf3f","metric":2313,"metrics":{},"status":"keep","description":"Add outcomes stress tests - complex nested ok, withDiagnostics chaining, collectOutcomes with 50, long diagnostic message, fromError with non-Error/string/number, degraded falsy values, fatal with 20 diagnostics","timestamp":1773495135726,"segment":0}
{"run":158,"commit":"2878677","metric":2323,"metrics":{},"status":"keep","description":"Add task-state-machine deep tests - ALLOWED_TRANSITIONS has all states/pending transitions/done limited, isTransitionAllowed consistency/self-transition/boolean, validateTransition allowed/disallowed, InvalidTransitionError instanceof/message","timestamp":1773495253325,"segment":0}
{"run":159,"commit":"578c5b8","metric":2335,"metrics":{},"status":"keep","description":"Add defaults deep tests - all 6 agent model strings have provider/model format, config agents have model entries, $schema present, enableToolsFor array, parallelExecution strategy","timestamp":1773495288790,"segment":0}
{"run":160,"commit":"7bb71a9","metric":2380,"metrics":{},"status":"keep","description":"Add index comprehensive export validation - 45 export checks covering utilities, paths, slug, shell, logger, detection, defaults, outcomes, state machine, trace context, task dependency graph, specFormatter","timestamp":1773495367033,"segment":0}
{"run":161,"commit":"51790e0","metric":2389,"metrics":{},"status":"keep","description":"Add types advanced tests - AgentModelConfig minimal/full, WarcraftConfig minimal/with-agents, SpecData all fields, TaskStatus retryCount/error/completedAt/startedAt","timestamp":1773495416697,"segment":0}
{"run":162,"commit":"f3988b1","metric":2393,"metrics":{},"status":"keep","description":"Add taskDependencyGraph stress tests - 50 independent tasks, long 20-step chain, fan-out/fan-in pattern, mixed done/pending siblings","timestamp":1773495501708,"segment":0}
{"run":163,"commit":"f8e7706","metric":2400,"metrics":{},"status":"keep","description":"Add trace-context stress tests - 50-deep nesting, 100 parallel unique spanIds, format consistency, parentSpanId chain, sibling same parent, custom traceId propagation, 100 unique roots. MILESTONE: 2400 TESTS EXACTLY (987→2400, +143.1%)","timestamp":1773495540807,"segment":0}
{"run":164,"commit":"c367305","metric":2520,"metrics":{},"status":"keep","description":"Add task-state-machine exhaustive tests - 64 transition matrix checks (8x8), 56 validateTransition consistency checks. MILESTONE: 2500+ TESTS (987→2520, +155.3%)","timestamp":1773495705575,"segment":0}
{"run":165,"commit":"f660cba","metric":2528,"metrics":{},"status":"keep","description":"Add fs stress tests - special chars/unicode/large arrays in JSON, empty/very-long text, deeply nested ensureDir, fileExists file-vs-dir, nested arrays-objects round-trip","timestamp":1773495746334,"segment":0}
{"run":166,"commit":"e03781d","metric":2541,"metrics":{},"status":"keep","description":"Add slug edge case tests - consecutive hyphens, trailing/leading spaces, tabs, mixed case, parentheses, deriveTaskFolder order 0/99/long-names/different-orders, deriveDeterministicLocalId empty/very-long/multi-vs-single","timestamp":1773495787810,"segment":0}
{"run":167,"commit":"ada3842","metric":2552,"metrics":{},"status":"keep","description":"Add shell stress tests - shellQuoteArg backticks/pipe/semicolons/ampersands/redirections/env-vars/unicode/very-long, structuredToCommandString many-args/spaces/paths","timestamp":1773495822076,"segment":0}
{"run":168,"commit":"27ead23","metric":2558,"metrics":{},"status":"keep","description":"Add fs-feature-store CRUD tests - create/list/get round-trips, get null for non-existent, create returns FeatureJson, 10 batch creates tracked","timestamp":1773495934375,"segment":0}
{"run":169,"commit":"8a1a7f1","metric":2574,"metrics":{},"status":"keep","description":"Add outcomes exhaustive tests - worstSeverity 9 combinations (3x3), fromError with all severity levels, diagnostic context undefined/string/number/nested","timestamp":1773495985228,"segment":0}
{"run":170,"commit":"2323406","metric":2583,"metrics":{},"status":"keep","description":"Add json-lock stress tests - deep merge, subdir write, array/null/empty/boolean/precision patches, concurrent lock acquire, missing file patch creates it","timestamp":1773496054460,"segment":0}
{"run":171,"commit":"aadbfd5","metric":2592,"metrics":{},"status":"keep","description":"Add specFormatter edge tests - code blocks/markdown lists in plan, empty allTasks, many deps, 10 completed tasks, special chars in feature name, high order, heading starts with #, unicode context","timestamp":1773496093831,"segment":0}
{"run":172,"commit":"5eb16dd","metric":2600,"metrics":{},"status":"keep","description":"Add paths beads mode tests - off/on different dirs, off is docs, on contains beads, different modes different feature/plan paths, sanitizeName numbers/hyphens-underscores/single-char. MILESTONE: 2600 TESTS EXACTLY (987→2600, +163.4%)","timestamp":1773496127584,"segment":0}
{"run":173,"commit":"95172f9","metric":2609,"metrics":{},"status":"keep","description":"Add planGates integration tests - full plan discovery/tasks/workflow/review, minimal plan fails discovery, empty 0 tasks, not lightweight without mini-record, format issues, validateLightweight returns array","timestamp":1773496277003,"segment":0}
{"run":174,"commit":"5eaadd7","metric":2625,"metrics":{},"status":"keep","description":"Add logger comprehensive tests - LOG_LEVELS exact values 0-3, sink captures all levels with timestamp/message/context, prefix option, noop logger returns void","timestamp":1773496442750,"segment":0}
{"run":175,"commit":"55d71a9","metric":2645,"metrics":{},"status":"keep","description":"Add taskDependencyGraph exhaustive tests - single task per status (8), dependency satisfaction per dep status (8), mixed status chains (done+pending+blocked, all done, failed/partial deps)","timestamp":1773496484957,"segment":0}
{"run":176,"commit":"f9fb9f0","metric":2655,"metrics":{},"status":"keep","description":"Add detection exhaustive tests - detectContext all properties at root, /tmp/home/temp paths, findProjectRoot from nested dir/root dir","timestamp":1773496521193,"segment":0}
{"run":177,"commit":"a705ddc","metric":2682,"metrics":{},"status":"keep","description":"Add event-logger exhaustive tests - all 13 event types validated as non-empty strings, noop logger emits all 13 without throwing, trust metrics shape validation (7 numeric fields)","timestamp":1773496561731,"segment":0}
{"run":178,"commit":"3823b74","metric":2691,"metrics":{},"status":"keep","description":"Add beads integration tests - beadsMode+requireBeads on/off, BeadGatewayError name/stack, beadDecoders nested JSON/description/long body, isBeadsEnabled type safety","timestamp":1773496647692,"segment":0}
{"run":179,"commit":"0521709","metric":2696,"metrics":{},"status":"keep","description":"Add defaults round-trip tests - WarcraftConfig type validation, agent model format, AgentModelConfig mapping, all 6 agent names present, temperature ranges","timestamp":1773496687453,"segment":0}
{"run":180,"commit":"b480dc0","metric":2700,"metrics":{},"status":"keep","description":"Add contextService stress tests - write/read multiple files, overwrite existing, list files for feature, read null for non-existent. MILESTONE: 2700 TESTS EXACTLY (987→2700, +173.5%)","timestamp":1773496731072,"segment":0}
{"run":181,"commit":"017cb6f","metric":2704,"metrics":{},"status":"keep","description":"Add transition-journal stress tests - 100 entries with correct seq, persistence across instances, interleaved features, all fields preserved","timestamp":1773496779967,"segment":0}
{"run":182,"commit":"8c22d2a","metric":2711,"metrics":{},"status":"keep","description":"Add state stores integration tests - feature+plan workflow, task store list/get/getNextOrder, cross-store independence, stores are independent instances","timestamp":1773496891094,"segment":0}
{"run":183,"commit":"b4b8fb9","metric":2717,"metrics":{},"status":"keep","description":"Add agentsMdService init tests - empty project, node/typescript/monorepo/python detection, apply with minimal AGENTS.md","timestamp":1773496935259,"segment":0}
{"run":184,"commit":"7bdb6f0","metric":2754,"metrics":{},"status":"keep","description":"Add paths exhaustive tests - getWarcraftPath/getFeaturePath/getPlanPath/getContextPath for all mode×project×feature combinations (6+6+6+6=24), sanitizeName valid (6) and invalid (7) inputs","timestamp":1773496976519,"segment":0}
{"run":185,"commit":"1d81bef","metric":2788,"metrics":{},"status":"keep","description":"Add slug exhaustive tests - international chars (7 inputs), deriveTaskFolder orders 1-20, deriveDeterministicLocalId consistency for 7 input combinations","timestamp":1773497014305,"segment":0}
{"run":186,"commit":"03e0650","metric":2800,"metrics":{},"status":"keep","description":"Add configService deep tests - default/noop logger, config with agents, getPath .json/.config/absolute, caching, different instances equal, beadsMode/sandbox string, parallelExecution strategy. MILESTONE: 2800 TESTS EXACTLY (987→2800, +183.7%)","timestamp":1773497055478,"segment":0}
{"run":187,"commit":"9249532","metric":2820,"metrics":{},"status":"keep","description":"Add factory exhaustive tests - featureStore 3 methods, planStore 4 methods, taskStore 13 methods verified via createStores off mode","timestamp":1773497182761,"segment":0}
{"run":188,"commit":"c899b83","metric":2831,"metrics":{},"status":"keep","description":"Add SimpleGitClient exhaustive tests - 8 interface method checks, constructor with cwd/tmp/nested paths","timestamp":1773497251599,"segment":0}
{"run":189,"commit":"8a7825f","metric":2939,"metrics":{},"status":"keep","description":"Add specFormatter combinatorial tests - 4×3×3×3 = 108 combinations of planSection(4)×contextFiles(3)×deps(3)×completedTasks(3). MILESTONE: 2900+ TESTS (987→2939, +197.8%)","timestamp":1773497292615,"segment":0}
{"run":190,"commit":"d94646b","metric":2984,"metrics":{},"status":"keep","description":"Add outcomes combinatorial tests - ok with 9 value types, degraded with 9 value types, worstSeverity 27 triple severity combinations. MILESTONE: TRIPLED THE BASELINE (987→2984, +202.2%)","timestamp":1773497334607,"segment":0}
{"run":191,"commit":"f2668ae","metric":3000,"metrics":{},"status":"keep","description":"Add DockerSandboxService exhaustive tests - validateImage with 8 valid images, buildRunCommand for each image. MILESTONE: 3000 TESTS EXACTLY (987→3000, +203.9%)","timestamp":1773497372267,"segment":0}
{"run":192,"commit":"fe01f89","metric":3011,"metrics":{},"status":"keep","description":"Add TaskService plan parsing integration tests - 3 basic tasks, folder naming, explicit/bullet-point deps, idempotent sync, preview matches sync, missing plan throws, duplicate task numbers, self-dependency, unknown dep number, task removal on plan shrink","timestamp":1773497617334,"segment":0}
{"run":193,"commit":"16a46a2","metric":3029,"metrics":{},"status":"keep","description":"Add TaskService lifecycle integration tests - manual task creation (folder naming, listing, getting, invalid priority/order, duplicate order), status transitions (pending→in_progress/done timestamps, pending clears timestamps, strict mode valid/invalid, callback fires), spec/report write/read, getRawStatus","timestamp":1773497706312,"segment":0}
{"run":194,"commit":"2a89889","metric":3033,"metrics":{},"status":"keep","description":"Add PlanService integration tests - write/read, nonexistent returns null, file creation, approve+isApproved, approve nonexistent fatal, modify plan revokes approval, identical content preserves approval, revokeApproval, sessionId, preloadedContent","timestamp":1773497822490,"segment":0}
{"run":195,"commit":"810f50d","metric":3052,"metrics":{},"status":"keep","description":"Add FeatureService integration tests - create/duplicate/invalid priority/ticket, get/list, getActive/getActive null when completed, updateStatus/complete/reopen, setSession/getSession, getInfo, patchMetadata mutable+immutable fields","timestamp":1773497865293,"segment":0}
{"run":196,"commit":"05e2d5c","metric":3055,"metrics":{},"status":"keep","description":"Add full workflow integration test - end-to-end: create feature→write plan→approve→sync tasks→start/complete tasks→check runnable→sync completion to feature. Also: dependency blocking and partial completion keeps feature open","timestamp":1773497944703,"segment":0}
{"run":197,"commit":"418cab8","metric":3065,"metrics":{},"status":"keep","description":"Add TaskService advanced plan parsing tests - special chars in names, code blocks, non-sequential numbers, preamble before tasks, single/10-task plans, cycle detection, implicit sequential deps, explicit none deps (independent), diamond dependency pattern","timestamp":1773497993558,"segment":0}
{"run":198,"commit":"c7d15ff","metric":3090,"metrics":{},"status":"keep","description":"Add BeadsRepository error handling tests - RepositoryError construction (name/code/message/cause/stack/inheritance), all 6 error codes, getRepositoryInternalCode from BeadGatewayError/RepositoryError/Error/null, isRepositoryInitFailure for BR_INIT_FAILED/BR_NOT_INITIALIZED, throwIfInitFailure","timestamp":1773498071023,"segment":0}
{"run":199,"commit":"66c4ec3","metric":3118,"metrics":{},"status":"keep","description":"Add artifactSchemas comprehensive tests - TaskState encode/decode all 8 statuses, all optional fields preserved, legacy format migration, invalid/null/empty handling, TaskStatus conversion round-trip, WorkerPrompt versioned/legacy string/object/raw, TaskReport versioned/legacy/raw, TaskSpec encoding with/without prior tasks","timestamp":1773498131631,"segment":0}
{"run":200,"commit":"45d8f3f","metric":3126,"metrics":{},"status":"keep","description":"Add TaskService reconciliation and runnable tests - adding task to existing plan, rename creates new, done/in_progress tasks survive removal, multiple syncs stable, computeRunnableStatus empty/chain/unblock after completing deps. EXPERIMENT #200","timestamp":1773498187717,"segment":0}
{"run":201,"commit":"051aaa7","metric":3132,"metrics":{},"status":"keep","description":"Add ContextService integration tests - write/read round-trip, multiple context files, read non-existent null, list empty, overwrite replaces, feature-scoped isolation, list returns ContextFile objects, large content preserved, special characters","timestamp":1773498310659,"segment":0}
{"run":202,"commit":"d7c821d","metric":3158,"metrics":{},"status":"keep","description":"Add beadMapping comprehensive tests - all 8 statuses return actions, done close+remove transient, in_progress claim, 4 deferred states produce defer with own label/remove others, pending/dispatch_prepared unclaim, label cleanup prevents accumulation","timestamp":1773498365795,"segment":0}
{"run":203,"commit":"3faf1d4","metric":3164,"metrics":{},"status":"keep","description":"Add TaskService spec generation tests - buildSpecData complete structure, plan section extraction by title, null plan content, context files, completed tasks, plan section fallback by order when title mismatches","timestamp":1773498413146,"segment":0}
{"run":204,"commit":"eabce77","metric":3172,"metrics":{},"status":"keep","description":"Add TaskService edge case tests - slug collision in plan/manual tasks, background patch idempotencyKey/workerSession/no-clobber-status, dispatch_prepared stamps preparedAt/appears as inProgress/preserves preparedAt through transition","timestamp":1773498461244,"segment":0}
{"run":205,"commit":"49afd27","metric":3266,"metrics":{},"status":"keep","description":"Add task-state-machine full matrix test - 64 isTransitionAllowed tests (8×8), self-transitions always allowed, cross-check with ALLOWED_TRANSITIONS, completeness check for all 8 statuses, valid target statuses, InvalidTransitionError properties","timestamp":1773498672808,"segment":0}
{"run":206,"commit":"5e4137b","metric":3270,"metrics":{},"status":"keep","description":"Add multi-feature integration test - two features operate independently, completing one doesn't affect other, context is feature-scoped, getActive returns first non-completed after completing one","timestamp":1773498718403,"segment":0}
{"run":207,"commit":"4cdc4f4","metric":3279,"metrics":{},"status":"keep","description":"Add FilesystemFeatureStore lifecycle tests - create/get round-trip, list, exists true/false, save updates, complete marks, reopen reopens, create with priority, create with ticket","timestamp":1773498756793,"segment":0}
{"run":208,"commit":"9bc1093","metric":3288,"metrics":{},"status":"keep","description":"Add FilesystemPlanStore lifecycle tests - isApproved before/after approval, different content hash, revokeApproval, syncPlanDescription, sessionId, no-op without feature.json, re-approve after revoke","timestamp":1773498796544,"segment":0}
{"run":209,"commit":"0f6c78c","metric":3303,"metrics":{},"status":"keep","description":"Add DockerSandboxService validation tests - 13 invalid image inputs rejected (empty/spaces/path traversal/injection), buildRunCommand workspace mount and command passing. MILESTONE: 3300+ TESTS (987→3303, +234.6%)","timestamp":1773498897880,"segment":0}
